{
  "id": "yunque.pack.rpa-replay",
  "name": "RPA Replay Pack",
  "version": "0.1.0",
  "description": "浏览器操作录制回放的可选自动化能力包。",
  "requiresCore": ">=0.1.0",
  "optional": true,
  "defaultState": "disabled",
  "backend": {
    "capabilities": [
      "rpa.status",
      "rpa.trace.store",
      "rpa.trace.detail",
      "rpa.recording.start",
      "rpa.recording.stop",
      "rpa.replay.dry_run",
      "rpa.executor.plan",
      "rpa.browser_intent.gate_plan",
      "rpa.action_tracer.handoff_plan",
      "rpa.evidence.export"
    ],
    "routes": [
      "/v1/rpa-replay/status",
      "/v1/rpa-replay/traces",
      "/v1/rpa-replay/traces/",
      "/v1/rpa-replay/recordings/start",
      "/v1/rpa-replay/recordings/stop",
      "/v1/rpa-replay/replay",
      "/v1/rpa-replay/executor/plan",
      "/v1/rpa-replay/evidence/"
    ],
    "permissions": [
      "rpa:read",
      "rpa:write",
      "rpa:execute"
    ],
    "routeSpecs": [
      {
        "method": "GET",
        "path": "/v1/rpa-replay/status",
        "description": "Read RPA replay pack shell status and trace-store readiness."
      },
      {
        "method": "GET",
        "path": "/v1/rpa-replay/traces",
        "description": "List recorded RPA trace summaries."
      },
      {
        "method": "POST",
        "path": "/v1/rpa-replay/traces",
        "description": "Create or import an RPA trace definition."
      },
      {
        "method": "GET",
        "path": "/v1/rpa-replay/traces/",
        "description": "Read one RPA trace by slug."
      },
      {
        "method": "POST",
        "path": "/v1/rpa-replay/recordings/start",
        "description": "Start a recording session shell for a future ActionTracer integration."
      },
      {
        "method": "POST",
        "path": "/v1/rpa-replay/recordings/stop",
        "description": "Stop a recording session and persist explicit steps as a trace."
      },
      {
        "method": "POST",
        "path": "/v1/rpa-replay/replay",
        "description": "Build a parameter-substituted dry-run replay plan for a trace."
      },
      {
        "method": "POST",
        "path": "/v1/rpa-replay/executor/plan",
        "description": "Build a non-destructive Browser Intent / ActionTracer executor handoff plan without consuming browser intent, executing browser actions, writing browser state, writing files or opening network targets."
      },
      {
        "method": "GET",
        "path": "/v1/rpa-replay/evidence/",
        "description": "Export a JSON evidence pack for one trace."
      }
    ]
  },
  "frontend": {
    "menus": [
      {
        "key": "rpa-replay",
        "label": "RPA 回放",
        "path": "/packs/rpa-replay",
        "icon": "workflow",
        "order": 90
      }
    ],
    "routes": [
      {
        "path": "/packs/rpa-replay",
        "component": "rpa/RPAReplayPackPage",
        "title": "RPA 回放"
      }
    ],
    "assets": {
      "type": "builtin",
      "entry": "rpa/RPAReplayPackPage"
    }
  },
  "sdk": {
    "typescript": "yunque-client/rpa-replay"
  },
  "update": {
    "channel": "stable",
    "rollback": true
  },
  "metadata": {
    "group": "automation-lab",
    "blueprint": "docs/spec/pack-runtime-blueprint.md",
    "stage": "pack-shell-before-executor",
    "sync": "backend-registry-drives-frontend",
    "descriptionStyle": "one-line-plus-three-examples",
    "example1": "录制浏览器操作并保存 trace。",
    "example2": "读取 trace 详情并生成 dry-run 回放。",
    "example3": "生成 Browser Intent / executor handoff 计划。",
    "usability": "experimental",
    "primaryActionLabel": "查看回放计划",
    "primaryActionPath": "/packs/rpa-replay",
    "usageSurface": "RPA 回放页、浏览器操作 trace、dry-run 回放计划与执行审批提示",
    "limitation": "当前主要保存和回放计划，不会自动控制浏览器或本机桌面执行真实 RPA。"
  },
  "status": "alpha"
}
