{
  "id": "yunque.pack.wasm-plugin",
  "name": "WASM Plugin Pack",
  "version": "0.1.0",
  "description": "将 WASM 插件注册、生命周期、沙箱 dry-run/执行、远程安装审批队列、installer continuation handoff 与下载缓存写回作为高风险可选能力包暴露。",
  "requiresCore": ">=0.1.0",
  "optional": true,
  "defaultState": "disabled",
  "backend": {
    "capabilities": [
      "wasm.status",
      "wasm.plugin.install",
      "wasm.plugin.list",
      "wasm.plugin.detail",
      "wasm.plugin.load",
      "wasm.plugin.unload",
      "wasm.plugin.execute",
      "wasm.host_abi.plan",
      "wasm.host_abi.execution_gate",
      "wasm.module.integrity_gate",
      "wasm.remote_install.plan",
      "wasm.remote_install.signature_verification_plan",
      "wasm.remote_install.approval_queue_plan",
      "wasm.remote_install.approval_plan",
      "wasm.remote_install.approval_decision_plan",
      "wasm.remote_install.approval_writeback_plan",
      "wasm.remote_install.approval_queue_writeback",
      "wasm.remote_install.installer_continuation_plan",
      "wasm.remote_install.installer_download_writeback",
      "wasm.evidence.export"
    ],
    "routes": [
      "/v1/wasm-plugin/status",
      "/v1/wasm-plugin/plugins",
      "/v1/wasm-plugin/plugins/",
      "/v1/wasm-plugin/plugins/load",
      "/v1/wasm-plugin/plugins/unload",
      "/v1/wasm-plugin/execute",
      "/v1/wasm-plugin/remote-install/plan",
      "/v1/wasm-plugin/remote-install/approval/plan",
      "/v1/wasm-plugin/remote-install/approval/decision/plan",
      "/v1/wasm-plugin/remote-install/approval/writeback/plan",
      "/v1/wasm-plugin/remote-install/approval/queue/writeback",
      "/v1/wasm-plugin/remote-install/installer/continuation/plan",
      "/v1/wasm-plugin/remote-install/installer/download/writeback",
      "/v1/wasm-plugin/evidence/"
    ],
    "permissions": [
      "wasm:read",
      "wasm:write",
      "wasm:execute",
      "wasm:audit"
    ],
    "routeSpecs": [
      {
        "method": "GET",
        "path": "/v1/wasm-plugin/status",
        "description": "Read WASM plugin pack shell status and sandbox readiness."
      },
      {
        "method": "GET",
        "path": "/v1/wasm-plugin/plugins",
        "description": "List registered WASM plugin metadata."
      },
      {
        "method": "POST",
        "path": "/v1/wasm-plugin/plugins",
        "description": "Register or dry-run validate a WASM plugin manifest."
      },
      {
        "method": "GET",
        "path": "/v1/wasm-plugin/plugins/",
        "description": "Read one WASM plugin manifest by slug."
      },
      {
        "method": "POST",
        "path": "/v1/wasm-plugin/plugins/load",
        "description": "Mark a registered WASM plugin as loaded and ready to execute."
      },
      {
        "method": "POST",
        "path": "/v1/wasm-plugin/plugins/unload",
        "description": "Unload a WASM plugin without removing its metadata."
      },
      {
        "method": "POST",
        "path": "/v1/wasm-plugin/execute",
        "description": "Execute or dry-run plan a loaded WASM plugin in the sandbox."
      },
      {
        "method": "POST",
        "path": "/v1/wasm-plugin/remote-install/plan",
        "description": "Preview a non-destructive remote signed WASM package install plan."
      },
      {
        "method": "POST",
        "path": "/v1/wasm-plugin/remote-install/approval/plan",
        "description": "Preview a non-destructive approval gate plan required before remote signed WASM package install."
      },
      {
        "method": "POST",
        "path": "/v1/wasm-plugin/remote-install/approval/decision/plan",
        "description": "Preview a non-destructive approval decision application plan without mutating the approval queue or installer state."
      },
      {
        "method": "POST",
        "path": "/v1/wasm-plugin/remote-install/approval/writeback/plan",
        "description": "Preview a non-destructive approval queue write-back bridge plan without persisting decisions or allowing installer continuation."
      },
      {
        "method": "POST",
        "path": "/v1/wasm-plugin/remote-install/approval/queue/writeback",
        "description": "Persist only a pack-local approval queue store record for a remote install decision; no package download, signature verification, plugin file write, or installer continuation is performed."
      },
      {
        "method": "POST",
        "path": "/v1/wasm-plugin/remote-install/installer/continuation/plan",
        "description": "Plan-only installer continuation handoff that consumes the pack-local approval queue store and emits installer handoff artifacts without download, network access, signature verification, plugin file writes, registration, or installer continuation."
      },
      {
        "method": "POST",
        "path": "/v1/wasm-plugin/remote-install/installer/download/writeback",
        "description": "Download an approved remote package into the pack-local installer cache after matching the approval queue record and SHA-256; no signature verification, extraction, plugin file write, registration, or remote_install_ready transition is performed."
      },
      {
        "method": "GET",
        "path": "/v1/wasm-plugin/evidence/",
        "description": "Export a JSON evidence pack for one WASM plugin and its permission plan."
      }
    ]
  },
  "frontend": {
    "menus": [
      {
        "key": "wasm-plugin",
        "label": "WASM 插件",
        "path": "/packs/wasm-plugin",
        "icon": "cpu",
        "order": 97
      }
    ],
    "routes": [
      {
        "path": "/packs/wasm-plugin",
        "component": "wasm/WASMPluginPackPage",
        "title": "WASM 插件"
      }
    ],
    "assets": {
      "type": "builtin",
      "entry": "wasm/WASMPluginPackPage"
    }
  },
  "sdk": {
    "typescript": "yunque-client/wasm-plugin"
  },
  "update": {
    "channel": "stable",
    "rollback": true
  },
  "metadata": {
    "blueprint": "doc/WASM-PLUGIN-ENGINE.md",
    "stage": "pack-shell-before-runtime-hosts",
    "risk": "high",
    "sync": "backend-registry-drives-frontend-and-installer-cache"
  },
  "distribution": {
    "manifestUrl": "https://packs.yunque.local/wasm-plugin-pack/pack.json",
    "packageUrl": "https://packs.yunque.local/wasm-plugin-pack/wasm-plugin-pack-0.1.0.tgz",
    "frontendUrl": "https://packs.yunque.local/wasm-plugin-pack/frontend/remoteEntry.js",
    "sha256": "0123456789abcdef0123456789abcdef0123456789abcdef0123456789abcdef",
    "sizeBytes": 4096
  }
}
