{
  "id": "yunque.pack.cognitive-canary",
  "name": "Cognitive Canary Pack",
  "version": "0.1.0",
  "description": "认知质量灰度放行的可选治理能力包。",
  "requiresCore": ">=0.1.0",
  "optional": true,
  "defaultState": "disabled",
  "backend": {
    "capabilities": [
      "cognitive_canary.status",
      "cognitive_canary.scenarios.list",
      "cognitive_canary.scenarios.save",
      "cognitive_canary.evaluate",
      "cognitive_canary.shadow.plan",
      "cognitive_canary.response_collector.plan",
      "cognitive_canary.response_collector.writeback",
      "cognitive_canary.response_collector.pipeline.plan",
      "cognitive_canary.judge.plan",
      "cognitive_canary.metrics.plan",
      "cognitive_canary.rollback.plan",
      "cognitive_canary.report.list",
      "cognitive_canary.report.detail",
      "cognitive_canary.evidence.export"
    ],
    "routes": [
      "/v1/cognitive-canary/status",
      "/v1/cognitive-canary/scenarios",
      "/v1/cognitive-canary/evaluate",
      "/v1/cognitive-canary/shadow/plan",
      "/v1/cognitive-canary/response-collector/writeback",
      "/v1/cognitive-canary/response-collector/pipeline/plan",
      "/v1/cognitive-canary/reports",
      "/v1/cognitive-canary/reports/",
      "/v1/cognitive-canary/evidence/"
    ],
    "permissions": [
      "cognitive_canary:read",
      "cognitive_canary:write",
      "cognitive_canary:audit"
    ],
    "routeSpecs": [
      {
        "method": "GET",
        "path": "/v1/cognitive-canary/status",
        "description": "Read Cognitive Canary pack shell status, readiness flags and latest SLI summary."
      },
      {
        "method": "GET",
        "path": "/v1/cognitive-canary/scenarios",
        "description": "List deterministic local canary scenario definitions."
      },
      {
        "method": "POST",
        "path": "/v1/cognitive-canary/scenarios",
        "description": "Save or merge canary scenario definitions."
      },
      {
        "method": "POST",
        "path": "/v1/cognitive-canary/evaluate",
        "description": "Evaluate selected stable/canary shadow pairs and generate a cognitive quality report."
      },
      {
        "method": "POST",
        "path": "/v1/cognitive-canary/shadow/plan",
        "description": "Generate a non-destructive shadow traffic, LLM-as-Judge, metrics and rollback write-back plan for a Cognitive Canary report."
      },
      {
        "method": "POST",
        "path": "/v1/cognitive-canary/response-collector/writeback",
        "description": "Persist deterministic response collector plan metadata into the pack-local JSON store without mirroring live traffic or writing release state."
      },
      {
        "method": "POST",
        "path": "/v1/cognitive-canary/response-collector/pipeline/plan",
        "description": "Build a plan-only live response collector pipeline handoff from the pack-local response collector store without mirroring traffic, writing response artifacts, invoking LLM-as-Judge, publishing metrics, or rolling back releases."
      },
      {
        "method": "GET",
        "path": "/v1/cognitive-canary/reports",
        "description": "List saved Cognitive Canary reports."
      },
      {
        "method": "GET",
        "path": "/v1/cognitive-canary/reports/",
        "description": "Read one saved Cognitive Canary report by id."
      },
      {
        "method": "GET",
        "path": "/v1/cognitive-canary/evidence/",
        "description": "Export a JSON evidence pack for one Cognitive Canary report."
      }
    ]
  },
  "frontend": {
    "menus": [
      {
        "key": "cognitive-canary",
        "label": "Cognitive Canary",
        "path": "/packs/cognitive-canary",
        "icon": "activity",
        "order": 97
      }
    ],
    "routes": [
      {
        "path": "/packs/cognitive-canary",
        "component": "ops/CognitiveCanaryPackPage",
        "title": "Cognitive Canary"
      }
    ],
    "assets": {
      "type": "builtin",
      "entry": "ops/CognitiveCanaryPackPage"
    }
  },
  "sdk": {
    "typescript": "yunque-client/cognitive-canary"
  },
  "update": {
    "channel": "stable",
    "rollback": true
  },
  "metadata": {
    "blueprint": "doc/COGNITIVE-CANARY.md",
    "stage": "pack-shell-before-shadow-traffic",
    "risk": "cognitive-governance",
    "sync": "backend-registry-drives-frontend",
    "descriptionStyle": "one-line-plus-three-examples",
    "example1": "维护认知场景集并运行 deterministic judge。",
    "example2": "生成 shadow response 收集与指标计划。",
    "example3": "导出 canary 评估和回滚证据包。",
    "usability": "experimental",
    "primaryActionLabel": "查看 Canary 面板",
    "primaryActionPath": "/packs/cognitive-canary",
    "limitation": "当前主要运行本地确定性评估和计划生成，不会自动镜像真实流量、调用线上 Judge、发布指标或回滚版本。"
  },
  "status": "alpha"
}
