{
  "id": "yunque.pack.session-queue",
  "name": "Session Queue (会话任务队列)",
  "version": "0.1.0",
  "description": "会话任务队列：查看各会话的待执行任务，按会话查看队列快照，并取消尚未开始的排队任务。",
  "requiresCore": ">=0.1.0",
  "optional": true,
  "defaultState": "enabled",
  "backend": {
    "capabilities": [
      "queue.read",
      "queue.cancel"
    ],
    "routes": [
      "/v1/sessions/queue",
      "/v1/sessions/queue/cancel"
    ],
    "permissions": [
      "queue:read",
      "queue:write"
    ],
    "routeSpecs": [
      {
        "method": "GET",
        "path": "/v1/sessions/queue",
        "description": "List all session queues or inspect one session queue with ?id=."
      },
      {
        "method": "POST",
        "path": "/v1/sessions/queue/cancel",
        "description": "Cancel a queued task for a session."
      }
    ]
  },
  "frontend": {
    "menus": [],
    "assets": {
      "type": "builtin"
    }
  },
  "sdk": {
    "typescript": "yunque-client/session-queue"
  },
  "update": {
    "channel": "stable",
    "rollback": true
  },
  "metadata": {
    "group": "work",
    "phase": "A3",
    "preload": "true",
    "note": "Natively owns /v1/sessions/queue and /v1/sessions/queue/cancel through the Pack Runtime gate.",
    "usability": "infrastructure",
    "primaryActionLabel": "查看任务中心",
    "primaryActionPath": "/missions",
    "usageSurface": "任务中心、会话队列与待执行任务",
    "example1": "查看某个会话下尚未开始的任务队列。",
    "example2": "取消排队中但还没执行的任务。",
    "example3": "帮助 Chat 和任务中心保持同一套排队状态。"
  },
  "status": "beta"
}
