{
  "id": "yunque.pack.cognitive-layer",
  "name": "Cognitive Layer Pack",
  "version": "0.1.0",
  "description": "云雀认知层总开关：记忆/反思/做梦/自进化可一键热启停。",
  "requiresCore": ">=0.1.0",
  "optional": true,
  "defaultState": "enabled",
  "backend": {
    "capabilities": [
      "cognitive_layer.status",
      "cognitive_layer.toggle"
    ],
    "routes": [
      "/v1/cognitive-layer"
    ],
    "permissions": [
      "cognitive_layer:read",
      "cognitive_layer:write"
    ],
    "routeSpecs": [
      {
        "method": "GET",
        "path": "/v1/cognitive-layer",
        "description": "Read whether the cognitive layer is currently enabled."
      },
      {
        "method": "POST",
        "path": "/v1/cognitive-layer",
        "description": "Hot-toggle the whole cognitive layer (memory/reflection/dreaming/evolution) at runtime, no restart."
      }
    ]
  },
  "sdk": {
    "typescript": "yunque-client/cognitive-layer"
  },
  "update": {
    "channel": "stable",
    "rollback": true
  },
  "metadata": {
    "sync": "backend-registry-drives-runtime",
    "descriptionStyle": "one-line-plus-three-examples",
    "example1": "关闭后云雀退化为干净的 planner+工具：只用工具，不记忆、不反思、不做梦。",
    "example2": "开启后恢复完整的记忆/反思/做梦/自进化闭环（完整云雀）。",
    "example3": "运行时一键热切，无需重启；人格/信任/安全护栏始终保留。"
  },
  "status": "beta"
}
